{
  "section_file": "lsdmu_c09_s04.md",
  "title": "What Form Will the Future Human Take?",
  "summary": "This section names the Future Human as the Diamond Soul, the maturated form of consciousness in which lifetimes of experience are integrated into a single, lucid identity. Two visionary streams converge: the Great Awakening, where the species attunes to a unified field and Source Consciousness, and the Diamond Soul, where reincarnational residues cohere and the ego’s shell gives way to a panoramic, time-deep selfhood. The claim is not merely metaphysical flourish; it is a structural diagnosis. The global systems crisis is read as the planet’s labor pains, synchronized with our inner metamorphosis. As institutions strain toward planetary integration, psyches strain toward psycho-spiritual integration; as Earth attempts to become one polity, we attempt to become one Soul. Pressure from the unraveling does not simply threaten—it accelerates the shedding of constricted identity, inviting Soul-awareness to emerge at civilizational speed. The ego, however capable, is shown as the architect of the very fragmentation it cannot heal; adolescence hoards, competes, and shortens horizons. The Soul inhabits history differently: it remembers that tomorrow’s Earth is one’s own future cradle, and so acts with patient stewardship. Reincarnation reframes diversity from an external fact to an internal library: having been the other across race, class, nation, and creed, we carry a latent empathy that can widen political will. Under scarcity, the ego narrows loyalty; the Soul expands care. Participation in inclusive policies and moral courage is presented not only as ethical duty but as a performative doorway—enacting the Soul into consciousness through collective choice. Finally, the text insists that most of this work is already complete. Evolution has gestated the integrative capacity across millennia; birth is sudden because gestation was long. The Future Human is not a novel species but the ripened synthesis of our lineage—the Diamond Soul stepping forward as history’s answer to its own self-made crises. Thus the chapter relocates hope from technological escalation to depth-integration: the form adequate to heal the world is a consciousness no longer at war with itself. In the book’s arc, this section names the telos of transformation—translating a global awakening into the concrete figure of the Diamond Soul and aligning inner realization with planetary deliverance.",
  "keywords": [
    "reincarnation",
    "ego",
    "integration",
    "planetary_crisis",
    "unified_awareness",
    "maturation",
    "stewardship",
    "empathy",
    "inclusivity"
  ],
  "concept_links": [
    "future_human",
    "diamond_luminosity"
  ],
  "notes": "Frames crisis as a midwife metaphor: external systems unraveling co-arises with inner integration. Locates agency in enacting inclusive choices that draw Soul-awareness into history.",
  "model": "gpt-5",
  "words_target": 400,
  "src_dir": "reflowed_text"
}