{
  "section_file": "lsdmu_c02_s04.md",
  "title": "Addendum: The Perinatal Level of Consciousness",
  "summary": "This addendum distills Grof’s perinatal level as the crucible where death and birth interpenetrate, turning therapy into a rite of passage whose realism can eclipse the very fact of the session. The ordeal discloses mortality not as an abstract idea but as an immediate annihilating event, drawing personal fear into the vortex of collective and even nonhuman suffering. Yet the same threshold often folds into a vivid reliving of one’s own birth, revealing an intimate hinge between somatic memory and transpersonal disclosure: biographical, biological, and archetypal layers co-arise as facets of a single intensification of consciousness.\n\nGrof’s architecture clarifies this intensity through COEX systems—affectively charged constellations of memories that stratify from recent surface experiences to a core wound—and through the Basic Perinatal Matrices, COEX systems anchored in fetal experience. The four phases of biological birth provide a deep grammar of experience: the oceanic plenitude or toxicity of the womb; the sealed, assaultive “no-exit” of early labor; the violent, eroticized struggle of passage; and the annihilation-release of emergence. Each matrix attracts later biographical episodes and fantasies that rhyme with its theme, gradually acquiring gravitational weight that shapes perception, character, and fate. When a matrix erupts in psychedelic work, the psyche presents a coherent polyphony: bodily sensations of birth, biographical trauma, mythic tableaux, and philosophical insight align around the same affective vector.\n\nThe matrices, then, function as a psychospiritual physiology: BPM I as unitive bliss or alienated malaise; BPM II as helpless entrapment beneath the sovereign fact of death; BPM III as titanic, ambivalent combustion of rage, sexuality, and ecstatic force; BPM IV as total dissolution becoming sudden liberation, love, and illumination. Progress through them is iterative rather than linear; crises are yielded to and resolved across serial sessions until their charge is spent. As the perinatal constellations dissolve, access opens directly into transpersonal domains. Strikingly, Grof reports a consistent reorientation: those who traverse this depth—skeptics and scientists included—spontaneously adopt a spiritual construal of existence, not by persuasion but by the authority of experience.\n\nIn this light, psychopathology can appear as perinatal turbulence and healing as ritual passage through archetypal death and birth, where the personal body remembers the cosmos remembering itself. As an addendum, this section supplies the book’s overarching arc with a precise cartography of crisis and renewal, rooting its wider thesis about psychedelic consciousness in a rigorous map of transformation.",
  "keywords": [
    "perinatal consciousness",
    "basic perinatal matrices",
    "coex systems",
    "psychedelic therapy",
    "death-rebirth",
    "transpersonal",
    "birth trauma",
    "existential crisis",
    "collective unconscious"
  ],
  "concept_links": [
    "death_rebirth",
    "diamond_luminosity"
  ],
  "notes": "Synthesis of Grof’s BPM/COEX model emphasizing phenomenological coherence over clinical detail; notes the contested status of biological verification and Grof’s strong claim about universal spiritual reorientation.",
  "model": "gpt-5",
  "words_target": 400,
  "src_dir": "reflowed_text"
}