{
  "section_file": "lsdmu_c01_s10.md",
  "title": "lsdmu_c01_s10 — Platforms of Experience",
  "summary": "The author frames the journey as a series of deepening immersions into consciousness that reveal correspondingly deeper strata of reality, while refusing to canonize a single linear sequence. Because the universe is holographically integrated, depth can irrupt anywhere: a minor aperture may open into vastness. Yet by standardizing conditions across many sessions, a rough choreography emerged—distinctive plateaus or platforms of experience—each with its own textures, laws, and recognitions. These are not declared universal. They are the contours of one person’s “bore hole” into the cosmos, a narrow but penetrating shaft through many levels rather than an exhaustive survey of any one domain. \n\nTo name these platforms, the author adapts Stanislav Grof’s phenomenology of states—psychic, subtle, and causal—while acknowledging Ken Wilber’s use of the same terms as developmental stages. The methodological pivot is crucial: instead of a ladder of spiritual attainment, these categories designate recurring state-patterns that arise in psychedelic and breathwork sessions, with higher and lower instances within each band. They are descriptive not prescriptive; phenomenological rather than teleological. Still, the author accepts a realist premise: states do not merely color perception; they open onto corresponding levels of reality. Subtle consciousness reveals subtle worlds; causal consciousness, causal worlds. The wager is ontological, not merely psychological: entering these states grants access to deeper architecture. \n\nThe psychic platform expands awareness beyond the physical without fully dissolving the habits of space-time conditioning. The psyche carries its inherited grammar of separateness into the nonphysical. Experience becomes soul-centric and relationally atomized: one appears as a distinct discarnate self among other discrete presences. The textures here include kinship with guides, ancestors, or entities, but the underlying pattern is multiplicity within a familiar subject–object frame. The spiritual feels near at hand but still organized by the reflex of boundaries. It is not yet a renovation of the grammar of being; it is a widening of its vocabulary. \n\nThe subtle platform, despite its name, is anything but delicate. Here the scaffolding of reality comes into view: the load-bearing girders that brace and shape lifeworlds. The personal soul can dilate into the larger Soul—an enduring thread across incarnations—and the mind may slip into species-mind, collective fields, or archetypal generative forces that draft space-time and its contents. What appears is less a gallery of beings than the formative patterns that birth beings: morphic templates, living ideas, and the constitutive symmetries from which worlds precipitate. Parts remain, but they are larger, more primordial. Individual identity is still operative, yet it begins to function as a window rather than a wall. One participates in the composing intelligence of creation, sensing that one’s life is a stanza in a longer poem authored by the Soul and echoed across forms. \n\nThe causal platform marks the turning wherein the sense of distributed parts yields to the experience of the universe moving as a single organism. The signature is Oneness: not a concept or mood but a wholesale transparency where interior and exterior collapse into a single field without an outside. In this vastness, the ancient intuition that everything breathes together takes on cardiological clarity. The cosmos is encountered as one life, inhaling and exhaling itself. In the causal, Light intensifies. Luminosity may have visited earlier, but here it becomes the medium as much as the message—the felt matter of unity, increasingly refined as consciousness deepens. One can taste a spectrum within this domain: from a lower causal radiance coherent with the icon of a single God to a higher, more faceted brilliance the author names Diamond Luminosity. This apex feels like intelligence made light and light made knowing, a jewelled clarity whose edges can seem to cut beyond even the causal frame, though the author resists codifying this as another tier. \n\nThroughout, the author maintains a disciplined humility about maps. Three words cannot compass the ocean of spiritual reality; any taxonomy is a temporary raft. The value of these categories is heuristic: they help track recurring patterns across sessions and provide a shared lexicon for phenomena that otherwise resist discourse. Moreover, by keeping the emphasis on states—on what actually shows up—rather than on ideals of development, the narrative honors the participatory nature of revelation. Different practitioners in different contexts will sequence these domains differently; no one itinerary binds the real. The cosmology implied is plural and dialogical: reality discloses itself in response to the questions we are, the vessels we become, and the ritual ecologies we build. \n\nCrucially, this section balances two commitments often held apart. First, a phenomenological commitment: describe what arises without forcing it into a triumphalist ladder. Second, an ontological commitment: treat what arises as contact with levels that are not reducible to private fantasy. The result is a stance of rigorous openness—refusing both naïve literalism and corrosive reductionism. The platforms are not idols; they are instruments. They chart dependable signatures without mistaking the chart for the sea. \n\nThe bore-hole metaphor threads the author’s confession of limits: depth gained at the expense of breadth. There is no claim to have toured the entire psychic realm or mapped the whole subtle architecture; instead, the value lies in the throughline—a set of repeated crossings that allow pattern-recognition across years. Within that continuity, what matures is discernment: learning how the atmospheres of each platform smell and move; how agency is configured; what kinds of truth and therapy each affords; and how Light behaves as Oneness grows more vivid. The section thus supplies conceptual ballast for the experiential narratives to come: when the author later speaks of subtle or causal disclosures, the reader will recognize the register. \n\nIn this way, Platforms of Experience offers both lexicon and ethos: names for distinct states and a methodological caution against making them idols, inviting us to treat the journey as a participatory apprenticeship to reality’s deeper orders without collapsing plurality into a single, triumphant map. As such, it situates the reader at the threshold of the book’s arc: a path of temporary immersions that, through disciplined repetition, reveal an ordered yet unpredictable universe and the shining gradients of Oneness that draw the narrative forward.",
  "keywords": [
    "platforms of experience",
    "psychic",
    "subtle",
    "causal",
    "oneness",
    "diamond luminosity",
    "participatory cosmology",
    "holographic universe",
    "states vs stages"
  ],
  "concept_links": [
    "diamond_luminosity",
    "non_duality"
  ],
  "notes": "Adopts Grof’s state-based usage of psychic/subtle/causal while decoupling from Wilber’s developmental hierarchy; affirms a realist correspondence between states and levels; emphasizes humility and variability within a participatory cosmology.",
  "model": "gpt-5",
  "words_target": 1000,
  "src_dir": "reflowed_text"
}