{
  "section_file": "lsdmu_c07_s01.md",
  "title": "Entering Archetypal Reality",
  "summary": "The section records a threshold crossing from personal identity into a field of archetypal being where even species-identity loosens and falls away. What begins as ego-death matures into a deeper erasure: the tacit sense of being human proves to be a costume that cannot be refitted once the current of a vaster consciousness takes hold. From a vantage like an orbital platform above the species-mind, awareness stabilizes in a station that is simultaneously impersonal and intimate, instructional and searing. Proximity to the generative source intensifies everything: reality is rendered at a higher voltage, a sun-hot medium that overwhelms ordinary continuity unless the perceiver is refashioned to metabolize it. Thus purification becomes technical necessity rather than moralism. The ensuing work—named Grinding the Bones—functions as shamanic dismemberment by sound. In Session 25, Tibetan chant fuses with primordial Africa: elders assemble, the body of desire is seized and sung apart, and the bone-deep scaffolding of the self is ground to dust so it can be rewrought as a conductor. The ritual feels merciless and compassionate in equal measure—the pedagogy of ancient grandparents who will not collude with the inertia of appetite. Desire and its secondary narratives are extinguished in sweeping arcs; into the vacancy, raw energy is poured and packed through vibration, like a battery being charged until the bones thrum with impersonal power. The cost is real—re-entry to ordinary embodiment is slow—but the gain is a new capacitance: an organism gradually able to sustain hours within archetypal amperage without fragmenting memory or coherence. After this, the text delineates two orders of the subtle encountered ahead: a higher, Platonic stratum where intelligible archetypes organize like lucid geometries, and a lower, Jungian imaginal where mythic figures constellate at closer range to psychic life. Both are archetypal, different in scale and density, requiring further stabilization as one shifts platforms of awareness. Across it all the movement is clear: from human-centered experience to a cosmological function, from the heat of personal longing to the clarity of transpersonal service, bones retooled into pillars able to carry the charge of the Real. This section marks the book’s decisive passage from autobiographical dissolution toward a sustained cartography of the archetypal field the remaining chapters will explore.",
  "keywords": [
    "archetypal reality",
    "species-identity",
    "ego-death",
    "shamanic dismemberment",
    "tibetan chanting",
    "elders",
    "high-voltage consciousness",
    "subtle planes",
    "platonic",
    "jungian"
  ],
  "concept_links": [
    "death_rebirth",
    "future_human"
  ],
  "notes": "Treat the cross-cultural ritual imagery with care—frame it as archetypal synthesis rather than cultural appropriation; the recurring motif of bones can serve as an editorial throughline for energetic capacity and structural transformation.",
  "model": "gpt-5",
  "words_target": 400,
  "src_dir": "reflowed_text"
}