{
  "section_file": "lsdmu_c04_s00.md",
  "title": "The Ocean of Suffering",
  "summary": "Opening with Shantideva’s vow, the author situates the chapter as an uncompromising consecration to the liberation of all beings, even at the cost of personal ease. He refuses to soften what follows, arguing that descent into the infernal is not an endorsement of punitive cosmology but a testimony to rescue and deliverance. What unfolds is a passage from private breakdowns into a collective domain he names the Ocean of Suffering—a vast field of human fury and pain that exceeds individual biography. The work becomes liturgical: in each session he is returned to the same landscape, taken deeper, then released into luminous transpersonal blessings. By recognizing this cadence—anguish cresting into resolution, resolution opening into peace—he learns to trust a cycle in which completion is the medicine that prevents trauma from congealing.\n\nThe chapter frames a discipline of surrender: to open fully, allow intensity to peak, and stay until the wave has spent itself. This stance transforms pathology into purification; the self becomes a vessel through which the collective unconscious discharges its backlog. The author notes the pragmatic mercy of time—each immersion lasted hours, then was followed by months of digestion—yet anticipates the contractions that precede descent, the soldier’s resolve and the laboring mother’s inward turn, “going into the tunnel.”\n\nChronologically, the Ocean spans fourteen sessions over two years, cleaved by a six-year hiatus that changes nothing in the interior continuity; experientially, the work resumes as if mid-breath. For clarity, the author divides the first year into a cleansing phase and an ecstatic phase, promising in this chapter the former—an account of the dark hydraulics that scour the psyche—while reserving the latter’s adventures for the next. The methodological claim is ethical as much as therapeutic: if suffering is carried to its true end, it discharges and leaves peace; if truncated, it calcifies into trauma. Paired with the Bodhisattva’s longing for universal freedom, this pedagogy of completion reframes hell as a corridor to compassion rather than a verdict of guilt. In establishing both the furnace and the rhythm that tempers the heart, this chapter positions the reader to endure the depths so as to receive the heights.\n\nAs such, this section marks the book’s hinge into collective purgation and sets the structural rhythm—descent, completion, release—that will govern the arc from cleansing to ecstasy and beyond.",
  "keywords": [
    "bodhisattva",
    "collective unconscious",
    "suffering",
    "completion",
    "trauma",
    "surrender",
    "purification",
    "transpersonal",
    "rhythm",
    "ecstasy"
  ],
  "concept_links": [
    "death_rebirth",
    "collective_unconscious"
  ],
  "notes": "Editor’s note: This chapter inaugurates the ‘cleansing phase’ of the first seven sessions, insisting on full completion as anti-traumatic practice and explicitly countering punitive readings of hell imagery.",
  "model": "gpt-5",
  "words_target": 400,
  "src_dir": "reflowed_text"
}