{
  "section_file": "lsdmu_c09_s03.md",
  "title": "The Nonlinear Dynamics of Awakening",
  "summary": "This section shifts the focus from cataloging psychedelic phenomena to building a transdisciplinary grammar for their civilizational import. It advances a bold but carefully scaffolded claim: humanity participates in a species-mind—an immanent field of psyche—that, under the intensifying stress of ecological and social breakdown, will be driven far from equilibrium. In such a hyperaroused regime, the collective psyche may display hallmark features observed in complex nonlinear systems: accelerated phase shifts, spontaneous creativity, and higher orders of self-organization. To ground this claim, the author braids systems analysis (Meadows), field hypotheses (Sheldrake), chaos and dissipative structure theory (Prigogine), global brain imaging (Russell), threshold research (Ring), and archetypal historiography (Tarnas). The proposed upshot is psychological phase-locking: interhuman linkages, formerly too subtle to register, precipitate into felt coherence, enabling rapid, synergistic coordination.\n\nRather than re-argue the technical case, the author underscores its consonance with Tarnas’s genealogy of Western consciousness: a long arc from primal embeddedness through individuating separation to a death of identity that reopens the cosmic matrix without forfeiting the gains of differentiation. In Grofian terms, the species now traverses a perinatal passage; crisis is not exception but archetype, the very corridor through which rebirth becomes possible.\n\nTwo decades on, the forcing function has intensified—climate destabilization, cascading disasters, predatory inequality, and the anesthetics of denialist politics. Paul Gilding’s tipping-point scenario is invoked as a forecast of systemic cascades that could collapse the old attractor basin. The question is not whether suffering will rise, but whether the species-field, supercharged by it, will flip into coherence—magnifying synchronicity, igniting the Sacred Mind, and converting pain into the alchemical heat of collective metamorphosis. The wager here is not naive optimism; it is a complexity wager: turbulence can midwife higher order when feedback, meaning, and attention entrain.\n\nPsychedelic practice is thus reframed as a microcosmic rehearsal for planetary bifurcation: disciplined encounters with ego-death cultivate the capacities—trust in process, tolerance for liminality, attunement to field effects—needed when the historical waveform crests. In luminous shorthand: our darkest compression could be the pressure that crystals the new lattice of mind. In the architecture of the book, this section names the systemic portal—how the dark night of crisis becomes the nonlinear gate through which the early dawn of collective awakening moves toward integrative wholeness.",
  "keywords": [
    "species-mind",
    "far-from-equilibrium",
    "morphic fields",
    "dissipative structures",
    "tipping point",
    "synchronicity",
    "collective psyche",
    "great awakening",
    "ecological crisis"
  ],
  "concept_links": [
    "death_rebirth",
    "future_human"
  ],
  "notes": "The excerpt foregrounds intertextual scaffolding (Meadows, Sheldrake, Prigogine, Tarnas) to legitimate a visionary thesis; the closing quotation (truncated in the source) signals a turn toward praxis via Sacred Mind and synergistic creativity.",
  "model": "gpt-5",
  "words_target": 400,
  "src_dir": "reflowed_text"
}