{
  "section_file": "lsdmu_apx01_s01.md",
  "title": "APPENDIX I: What Dies and Is Reborn?",
  "summary": "This appendix asks a deceptively simple question that organizes the entire economy of psychedelic initiation: when the cycle of dying and being reborn repeats, what, precisely, is it that perishes and returns? The author’s answer unfolds as a spiral that sheds progressively subtler skins—first the personal ego, then a species-level identity, and finally a sophisticated, state-specific transpersonal self assembled through practice. The inquiry is less about metaphysical annihilation than about discerning which patterned coherences of memory, habit, and knowledge currently occupy the center of identification—and why, at each threshold, that center must yield to a still more capacious awareness.\n\n1. The Ego: In the early passages, death appears as the loosening of the body-mind’s claim on reality—its biography-bound assumptions, reflexes, and convictions. The death of the ego is not a verdict on the value of personality but an initiatory loosening of the knots that bind consciousness to a single life’s narrative. Rebirth here is the re-emergence of presence freed from the compulsion to be the story it tells about itself. This phase clarifies why initial experiences feel physically terminal: the organismic self takes the loss of command as a mortal threat. Yet once this surrender becomes familiar and trust grows, the emphasis shifts. The sense of dying persists, but it no longer attaches to the same local identity. The process is revealed as a method of exchange: relinquish a contracted center, and a wider field becomes the new home.\n\n2. The Species Ego: Deeper sessions tilt toward the collective. The subject’s center dilates until it resonates as an organ of the human species’ psyche. Here the dying concerns the “species ego”—those META-COEX systems (aggregates of condensed experience across time) that shape humankind’s self-understanding. The author’s therapeutic work in the “ocean of suffering” foregrounds the release of inherited trauma—violence, fear, betrayal—but the field is broader than pain. Just as binding are culturally engrained habits and prohibitions that tacitly compress the range of what we permit ourselves to be. Ecstatic transpersonal vistas dissolve the normative membranes that keep people circumscribed and separate; unfamiliar joy can be as revolutionary, and as threatening to the status quo, as the discharge of grief. A guiding intelligence becomes palpable here that exceeds the individual’s higher self: an archetypal mind that feels like the higher self of the species, tuning the process to the universe’s creative intention. Yet even this is not ultimate. The species ego, however grand, is a human-centered grammar in an immeasurably larger cosmos. As sessions deepen, the identity that dies is no longer merely personal or historical; it is the human-centric arc itself, overtaken by scales of relation that dwarf terrestrial imagination. This is the pivot where the practice asks for explanations that can hold a more-than-human becoming.\n\n3. The Shamanic Persona: To articulate what dies beyond the species ego, the author introduces the shamanic persona—a semiautonomous, state-specific consciousness that forms across many sessions. We often cannot recall from ordinary awareness what unfolded in deep states, yet on reentry the knowledge awaits us intact. The shamanic persona is the transpersonal integrator of those experiences, a living synthesis that remembers, consolidates, and operationalizes acquired capacities. It is not an archetype hovering in some abstract collective; it is the unique memory-body of one’s psychedelic life. Its density and stability depend on the coherence and integration of the work: fragmented or poorly held sessions produce a distant, foreign-feeling shamanic self; well-prepared, well-integrated explorations bring it close, intimate, a natural extension of everyday identity. The persona is also stratified by the level of consciousness in which the practitioner has stabilized—psychic, subtle, causal—each involving physiological and psychospiritual adaptations that allow reliable presence and recall. This account resonates with biological memory’s aggregating intelligence (as thinkers like Sheldrake and Laszlo propose): life keeps what it learns and organizes it into new forms of responsiveness.\n\nCrucially, the shamanic persona explains why the sense of dying continues even after personal and species identities have been surrendered. Any center that has cohered—no matter how transpersonal—can become a subtle enclosure. With the opening to deeper strata, one’s entire acquired mastery, along with the self built around it, must also be laid down. The raft that carried us across earlier waters is itself combustible fuel for the next crossing. In this light, death-rebirth is revealed as the meta-method of initiation: it metabolizes every provisional totality—the body-mind’s primacy, the species’ grand narrative, and even the luminous competence of the shamanic self—so that awareness can be reborn less contracted, more transparent to the unbounded ground that outshines all acquired identities.\n\nTaken together, these three layers reframe the affective signal of “I am dying” as a diagnostic: it marks exactly where identification is presently lodged. Initially, it is the ego’s fear of losing control; later, the tremor of collective myth shedding its skin; later still, the humility of relinquishing hard-won spiritual skill and status. Across all layers, what dies are crystallizations of memory—personal, cultural, transpersonal—that claim to be the whole. What is reborn is a larger intimacy with reality, an enlarging radiance that can include without clinging, act without possession, and know without contraction. In the author’s rendering, the intelligence guiding this spiral is both immanent (as the organism’s and the psyche’s intrinsic tendency to integrate) and transcendent (as the archetypal or cosmic creativity toward which the process leans). The work of liberation is therefore plural: trauma must be composted, yes; but so too must social constriction, conventional thought, spiritual pride, and even the refined persona that practices its own renunciation. The spiral continues until the need for any fixed persona subsides before the clarity that requires none.\n\nIn this appendix, the map is not a taxonomy for its own sake but a spiritual hygiene: by naming what dies at each turn, the practitioner is less likely to mistake a shedding for a self-destruction, a transition for an error, or a mastery for a home. In the context of the book’s wider vision, this clarification honors the realism of practice—its terrors, therapies, and ecstasies—while orienting the heart toward the horizon where the cycle accomplishes its deepest aim: to make us ever more available to the creative intelligence alive in and beyond us.",
  "keywords": [
    "ego-death",
    "species ego",
    "shamanic persona",
    "meta-coex",
    "collective unconscious",
    "transpersonal",
    "integration",
    "initiation",
    "morphic memory",
    "archetypal intelligence"
  ],
  "concept_links": [
    "death_rebirth",
    "future_human"
  ],
  "notes": "Source text truncates mid-sentence in the shamanic persona section; closing synthesis extrapolates in line with the chapter’s articulated logic. This appendix situates the book’s arc—from personal healing through collective liberation toward cosmological attunement—by clarifying the grammar of what must die at each threshold.",
  "model": "gpt-5",
  "words_target": 1000,
  "src_dir": "reflowed_text"
}