{
  "section_file": "lsdmu_c01_s03.md",
  "title": "LSD Sessions as a Path of Spiritual Awakening",
  "summary": "This section frames therapeutically structured LSD sessions as a contemporary expression of an ancient sacramental lineage, reclaiming them from the misperception that they shortcut spiritual work. The author enters the work with a meditator’s hunger for awakening and finds in Grof’s legacy a reliable cartography of ego death and rebirth. Yet the crucial reframing is neither mystical nostalgia nor pharmacological bravado; it is the sober recognition that psychedelic practice belongs to a distinct path: a path of temporary immersion. In contrast to meditation’s slow clarifying of mind, sacred medicines induce concentrated, time-bound intensifications of awareness that open wide the gates of communion. This acceleration is not false, and it is not trivial. But it is temporary, and what is temporary must be composted if it is to become character.\n\nThe section establishes a crucial dialectic between peaks and plateaus, states and stages. Maslow’s reminder about peak experiences and Wilber’s distinction between states and structures form the philosophical guardrails. One can be touched by vision without yet embodying vision. A medicine session can carry us across the threshold into luminous union, but the tendons of our being are not thereby strengthened; the limbs must still be trained. The soft underbelly of the medicine path is precisely its magnificence: the intensity can seduce us into mistaking altitude for durability. Therefore the central inquiry becomes practical and ethical: how do we partner with transient exaltation so that it ripens into lasting transformation?\n\nTwo virtues are named as the hinge on which this alchemy turns: courage and grounding. Courage is the readiness to suffer revelation. It is the willingness to enter what the author calls the shadow when bliss gives way to dread, grief, or annihilation. What surfaces under amplification does not respect our autobiographical boundaries: it arises from personal complexes, from the perinatal and the ancestral, from previous lives and the collective unconscious. This multivalent depth means that the obstacles to awakening may be utterly foreign to one’s conscious narrative; only by moving through them do we discover how they had cinched the heart. The medicine, then, is not a light we gaze at, but a pressure we consent to, breaking psychic adhesions we scarcely knew we had.\n\nGrounding gives those breakthroughs a home. The author insists that set and setting are necessary but insufficient; transformation also requires a vessel that endures between sessions. A genuine container holds memory, meaning-making, and enactment. Without such a vessel, the psyche is drawn to novelty and spectacle, mistaking churn for change. Grounding here is not only psychological; it is existential. Commitments to family, work, and community serve as ballast. The rhythm is archetypal: a descent into the deep followed by a return to the ordinary—children to feed, dishes to wash, classes to teach. Such ordinariness is not a dilution of the sacred but its test; integration measures whether the universe encountered on Saturday can be honored on Monday.\n\nThe integration proposed is full-bodied. Psychedelic openings happen as states of consciousness and states of body; they reorganize subtle energy as much as they reconfigure narrative meaning. Accordingly, the author situates the medicine path within a larger weave of practices that consolidate and extend the gains of the session. Ethical service keeps the heart porous and others-centered, resisting solipsistic spirituality. Psychological self-inquiry refines discernment, allowing symbolic material to settle into insight rather than inflation. Care of the body recognizes that tissues, breath, and nervous system are themselves archives of the journey; tending them is not ancillary but essential. And a daily spiritual practice—especially meditation—becomes the loom that catches the errant threads of session-day and weaves them into the fabric of a life. Over time, the throb of the peak is transmuted into a plateau, a steady altitude of awareness that does not depend on chemical provocation.\n\nAcross this reflection runs an older wisdom: sacraments are not escape routes but entrances. Ancient rites—the fields of Eleusis, the peyote teepee, the ayahuasca maloca—are invoked not as romantic backdrops but as evidence that humanity has known, again and again, that amplified consciousness can be consecrated and transformative. The modern therapeutic container is a descendant of these rites, subject to the same temptations toward excess and the same demands for reverence. When held skillfully, LSD sessions concentrate the labor of the soul, gradually training the person to metabolize intensity without fragmentation.\n\nThe prose also gestures forward. The author’s initial motive—enlightenment—meets a creative complication when a specific psychedelic protocol catalyzes an unanticipated second track that overtakes the original project. The details are deferred, but the structural implication is clear: the medicine path, when sincerely engaged, reveals aims the practitioner could not have set in advance. True practice is iterative revelation; one starts with ego death and discovers, in time, a larger ecology of transformation into which ego death is only one portal.\n\nIn sum, the section proposes a mature ethic for psychedelic spirituality: seek heights, but build ground; pursue breakthrough, but cultivate containment; face what arises, but return to what abides. The sacrament offers temporary immersion; the human life, structured by love and responsibility, is the vessel in which that immersion can crystallize into character. Courage opens the gate; grounding keeps the treasure. Through such discipline, states become stages, and what flashed for hours becomes who we are.\n\nThis section situates LSD practice within a continuity of sacred technologies, outlines the pitfalls of mistaking temporary elevation for abiding realization, and prepares the reader for the forthcoming discussion of protocol and the emergent second track that reorients the book’s journey.",
  "keywords": [
    "lsd",
    "ego-death",
    "integration",
    "grounding",
    "set and setting",
    "shadow work",
    "meditation",
    "service",
    "body",
    "sacrament"
  ],
  "concept_links": [
    "death_rebirth",
    "diamond_luminosity"
  ],
  "notes": "This section establishes the conceptual frame of temporary immersion versus meditation’s gradualism, introduces courage and grounding as the integrative hinge, and foreshadows a protocol-driven second track that will reshape the narrative arc.",
  "model": "gpt-5",
  "words_target": 1000,
  "src_dir": "reflowed_text"
}