{
  "section_file": "lsdmu_c02_s00.md",
  "title": "Crossing the Boundary of Birth and Death",
  "summary": "This opening movement declares a commitment to an ordeal the author refuses to abbreviate. Against the canonical lineage of cautious experimenters—Huxley’s single crystalline mescaline vision, Huston Smith’s few LSD occasions and the counsel to hang up after the message is received—the narrator chooses to remain on the line. The journey, once begun, takes over; the soul becomes apprentice to a power that trains, tests, and finally re-makes it. The first ten sessions are narrated not as a catalog of prodigies but as the scaffolding of an initiation, a paced intensification that teaches the organism how to endure and metabolize immensity. \n\nThe text situates high-dose LSD work as a form of athletic and sacerdotal training. It is not merely cognitive expansion but the conditioning of a whole subtle physiology for non-ordinary voltage. The capacities awakened are not sustainable without strengthening, purification, and a learned economy of attention. Early visions, the author admits, seem thin by the standards of what will come later, but their thinness is precisely their service: they stretch the membrane, alert the body to coming storms, and begin the slow conversion of reflex into readiness. What matters here is not the fireworks but the infrastructure—the purposeful construction of an inner temple capable of withstanding the weight of revelation. \n\nCrucial to this passage is the shift from personal to perinatal terrain. By choosing high doses, the author descends swiftly beneath the biographical coils of the individual unconscious into the shared basin of human birth and death. He confirms Stanislav Grof’s mapping: the perinatal level is not a chamber of private complexes but a crucible of universal wound. In that crucible, therapeutic narrative gives way to existential pressure. The question is not “What happened to me?” but “What happens to us?”—to bodies, to love, to every mortal thing. Here the psyche is stripped of its local grievances and summoned to wrestle with annihilation and emergence as cosmic facts. This is the first sovereignty the journey demands: the courage to suffer the truth that everyone and everything beloved will end, and to keep going. \n\nThe author names this phase “crossing the boundary of birth and death,” insisting that birth and death are not incidental events but the drumheads on which embodied time is stretched. To move beyond space-time awareness, one must pass through the membrane of physical consciousness. That membrane is both literal and archetypal: breath, heartbeat, bodily convulsions, and terror; also thresholds of identity, the unweaving of the story that holds the world together. The two-and-a-half years that carry these ten sessions form a sustained rite, whose rhythm the chapter signals through a sequence of titles: from “What Am I?” and “Infant Bliss” through “Confession to the Universe” and “Cosmic Attunement,” into “Overload,” “Distillation of My Life,” “Seamless Fabric,” “Extreme Convulsions,” “The Girls of the Neighborhood,” and “The Killing of the Children.” The arc suggests an ascent from inquiry to consonance, then intensifying pressure, a stripping down to essence, a brief glimpse of wholeness, and finally the dreadful passages where innocence and mortality touch. Even without details, the titles function as runes, mnemonic gates into depths that words must later approach. \n\nFour motifs crystallize as the chapter’s true content. First, a welcoming and strengthening intelligence precedes the breaking-open. The cosmos is not an indifferent void but a pedagogy—an order that prepares the pilgrim before shattering him. Initiation unfolds as grace before ordeal: a felt sense of being held, tuned, and aligned for what will soon exceed all familiar bearings. Second, strict purification of the body. Psychedelic spirituality, in this telling, is not a disembodied flight but a somatic refiner’s fire. Tremors, energetic surges, and visceral catharses forge a body capable of carrying and articulating the vastness it touches. The author’s emphasis on “subtle energy” underscores the concrete labor of rendering the nervous system porous yet resilient, akin to tempering a blade that must flex without breaking. \n\nThird, and most centrally, the confrontation with death. The early sessions are not devoted to mending personal biographical injuries but to the training of the soul in dying. This is less therapy than initiation into the human condition. The work is to feel fully and pass through the fear, grief, and awe that accompany the recognition of absolute finitude. In this climate, courage is not bravado but assent to the truth: that dissolution is not a failure of the self but a condition of its transformation. Death is rehearsed as a mode of knowledge. \n\nFourth, the collapse of physical identity—ego-death—as a gateway rather than an annihilating end. The book will later elaborate what opens beyond this collapse, but in these sessions the emphasis rests on the break itself: on the unfastening of the coherent, ordinary world; on the disassembly of the “someone” who imagines it can manage or engineer the sacred; on the humility required to allow the journey to own the traveler. The author’s framing is not triumphalist. He does not celebrate mastery over psychedelic states; he learns how to be mastered by them, to entrust himself to a process that knows more than he does about what is needed and when. \n\nThe chapter’s epigraph—“Before you get started, you own the journey. After you start, the journey owns you”—anchors the narrative in an initiatory ethic akin to indigenous rites that return agency by first taking it. To be owned by the journey is to enter into covenant with a larger intelligence that arranges ordeals for growth. In this light, the opening decade of sessions becomes an apprenticeship in cosmic obedience, where will is refined into willingness. The reader is thus invited not merely to witness visions but to share in a pedagogy of surrender, an ethics of endurance and receptivity equal to what the author calls the “enormous flows of energy” that define the LSD state. \n\nBy sketching the terrain and signaling the method (high-dose, long-form, somatic-spiritual training), the chapter also reframes expectations. It cautions against overvaluing the early lights, and it repositions psychedelic inquiry as a marathon rather than an epiphany hunt. The measure of progress is not the novelty of phenomena but the body-soul’s increased capacity to host them without fragmentation. Naming the sessions functions as both mnemonic and vow: each title is a seal that condenses the learning and binds the pilgrim to remembrance. \n\nIn sum, this section announces a threshold and describes the tools of its crossing. It insists that real spiritual work begins not with soothing but with exposure to the elemental realities of coming-into-form and passing-away. Its promise, only hinted here, is that beyond the membrane there is a more-than-personal field in which the self can be remade. But first, there is training, purification, and the slow, honest practice of dying. \n\nAs the first movement of the book’s arc, this chapter establishes the long apprenticeship, the rite of passage through perinatal consciousness, and the foundational ethic of surrender that will orient all subsequent depths.",
  "keywords": [
    "lsd",
    "perinatal consciousness",
    "ego-death",
    "initiation",
    "purification",
    "mortality",
    "subtle energy",
    "surrender",
    "ordeal"
  ],
  "concept_links": [
    "death_rebirth",
    "perinatal_gate"
  ],
  "notes": "Editorially, this section functions as a methodological prelude: it sets dose strategy, names the training arc, and provides a thematic index (via session titles) that foreshadows later, fuller narratives.",
  "model": "gpt-5",
  "words_target": 1000,
  "src_dir": "reflowed_text"
}