{
  "section_file": "lsdmu_c01_s11.md",
  "title": "Calling Down Heaven",
  "summary": "This section reorients the reader from a vertical myth of escape to a horizontal-deepening myth of consecrated presence. Where the Axial religions portray salvation as an ascent to a realm beyond decay, the author insists that the more radical and exigent work is to bring the radiance encountered in those heights into the thickness of earthly life. The text acknowledges the historical reasonableness of “up-and-out” cosmologies: when early contemplatives and psychonauts first touched the oceanic bliss and vast intelligence of the subtle domains, they understandably interpreted this ambiance as their true home and our embodiment as a fall. Yet, drawing on Sri Aurobindo’s evolutionary critique, the author argues that this is only half a truth. Yes, a spiritual universe surrounds and suffuses the physical; but the physical universe is not a prison so much as a gestational chamber within that larger matrix. The mother universe is slowly impregnating the daughter universe with consciousness, and this long labor cannot be abbreviated by flights to heaven without remainder.\n\nThis reframing shifts the locus of spiritual maturation from ascent to immanence, from leaving to participating. The Creative Intelligence that births space-time thinks in eons, not ecstasies. We are waking inside a garden billions of years in the making, with billions yet to ripen, and our awakenings matter not as tickets to elsewhere but as instruments by which the garden self-illuminates. The “incomplete” theologies rightly honor the sweetness of origin but miss the telos of incarnation: the divinization of matter through painstaking infusion. Against the impatience that sometimes haunts seekers—impatience that longs to dissolve into light—the chapter proposes a different hope: that the fruition of the divine project is the emergence of a world where light does not cancel density but pervades it, rendering matter translucent to spirit.\n\nIn this key, practice itself is reconceived. Reincarnation is presented not as a karmic treadmill to be abandoned but as a curriculum that stabilizes capacities across lifetimes. Psychedelic work, too, is reinterpreted. Early sessions may be voyages outward, cartographies of the more-than-human. Later practice becomes an alchemy of descent: “calling down heaven” into cells, nerves, breath. The point is no longer spectacular vision but the sedimentation of clarity and love into the body, the conversion of peak states into durable traits. The human organism is a vessel where heaven and earth mix, a crucible for transmutation. The sacred is not to be visited; it is to be precipitated, toned, metabolized.\n\nNonduality underwrites this ethic. When nirvana and samsara are truly one, there is no ultimate elsewhere to pine for, only degrees of transparency within flux. The measure of realization is not the distance one ascends from the world but the depth of intimacy one attains with it—the ease with which awareness saturates change without hardening into aversion or grasping. Heaven realized on earth is not an apocalyptic replacement of the world but the dawning recognition that the world, seen through undistorting eyes, is already threaded with heaven. What then “saves” is not escape but clarity embodied as compassion, patience, and creative service.\n\nThis vision integrates seamlessly with contemporary cosmology. The scientific revelation of deep time and an evolving universe invites a spirituality spacious enough to honor maturation rather than instant perfection. To think with the magnitudes of the Creative Intelligence is to accept slowness as sacred: epochal patience, iterative refinement, communal cultivation. Political, artistic, and ecological labors are reconceived as sacramental acts that help the planet become more consciously itself. In this light, psychedelic sacraments are not tourism to brighter realms but restoratives that reveal templates of wholeness; their efficacy depends on the subsequent descent—diet, movement, prayer, relationship, craft—through which those templates are “printed” into tissues and institutions. Without the ethical and bodily work of integration, the brightness of insight stays unincarnated, producing the very split the chapter seeks to heal.\n\nThe critique of Axial soteriology is thus not a repudiation but a completion. The archetype of ascent safeguarded the discovery of subtle worlds and their bliss. What was missing was a cosmology of arrival: the recognition that heaven seeks earth as much as earth seeks heaven, and that the sacred’s deepest pleasure is to dwell, not merely to be glimpsed. The Bodhisattvic vow is translated from a promise to postpone personal exit into a pledge to midwife the planet’s awakening, to embody the paradox of transparency-in-change until it becomes cultural habit. The spiritual universe is not elsewhere but interior to this one as its own depth. To call it down is to enact that interiority in voice, gesture, policy, design.\n\nAt stake is a healing of our most primal metaphors. If the body is not a fallen husk but a luminous instrument, if the earth is not exile but the beloved’s face, then practice ceases to be a war against gravity and becomes a choreography with it. The humility of apprenticeship replaces the triumphalism of escape. The psyche, no longer addicted to peak disembodiment, learns to bend light into form without burning it. The nervous system learns the music of coherence. Communities learn that patience and fidelity are technologies as subtle as any plant sacrament. In such a culture, visionary experience is not the goal but the tutor; the graduation occurs in kitchens, fields, councils, and laboratories where heaven takes on weight and time.\n\nThe section culminates in a simple, audacious claim: when transparency lives within perpetual change, the felt impulse to leave evaporates. This is not resignation but arrival—the end of exile through the marriage of clarity and embodiment. The invitation is to trust that the divine project is not elsewhere completed but here consummated, across many lives if necessary, through the quiet heroism of integration. The descent of grace becomes a daily art. The future human is not the one who escapes most cleanly but the one who conducts the most light with the least distortion. In that sense, “calling down heaven” names both a practice and a cosmology: a way of inhabiting time that lets eternity bloom in it. As a waypoint in the book’s pilgrimage, this chapter turns the compass from transcendence-as-departure to immanence-as-transformation, positioning the reader for subsequent explorations of how visionary knowledge becomes durable culture and living body.",
  "keywords": [
    "immanence",
    "axial religions",
    "psychedelic practice",
    "evolutionary cosmology",
    "sri aurobindo",
    "reincarnation",
    "nonduality",
    "embodiment",
    "sacred presence",
    "calling down heaven"
  ],
  "concept_links": [
    "future_human",
    "diamond_luminosity"
  ],
  "notes": "Positions the argument against escapist transcendence and toward embodied integration; prepares the reader for later chapters that operationalize descent, stabilization, and cultural enactment.",
  "model": "gpt-5",
  "words_target": 1000,
  "src_dir": "reflowed_text"
}