{
  "section_file": "lsdmu_c05_s00.md",
  "title": "Deep Time and the Soul",
  "summary": "This section marks a decisive pivot from ordeal to orientation: emerging from the Ocean of Suffering, the narrator repeatedly crosses into a domain where time dilates into a simultaneous field—past, present, and future co-present within a larger horizon he names Deep Time. He is careful to distinguish this state from timelessness and from cinematic time travel; it is not an escape from time, but entry into a different order of time, a transtemporal register in which one can dwell lucidly. At first, the experiences are too foreign to retain; only fragments return as tears and sudden nocturnal openings, often coaxed back by the music that carried him. Gradually, by revisiting the field across Sessions 11–17, he learns to “stay awake in Deep Time,” cultivating a phenomenological stamina that allows continuity of insight.\n\nWhat convinces him is not speculation but recurrence: each entry reveals the same meta-real landscape encompassing his life, marked by clarity rather than fantasy. The philosopher in him proposes a cautious bracketing—treat Deep Time as a way of experiencing rather than a claim about the universe. Yet the experiences themselves erode that distinction. Inside their envelopes, it feels inescapably real that the cosmos houses layered temporal modalities, and that linear time characterizes only the interior of ordinary spacetime. Science, with its arrow-of-time assumptions, offers no decisive adjudication here; neither quantum anomalies nor relativity’s extremes adequately license or refute what is known directly in the sessions. Thus he opts for radical empiricism: to report faithfully and let the reader weigh the ontological pressure of what is described.\n\nThe sequence of session-titles sketches a mandala of motifs for this new phase: the Great Oak (twice) suggests rootedness and vertical continuity; the Hillside of Karma (twice) intimates the moral topography of causes extended across spans; Descent into Hell acknowledges the heat by which insight is annealed; Caroland intimates the tender, constructed worlds of relation; and The Commitment of Yes signals consent to live by what Deep Time reveals. From here forward, time grows porous, and the work becomes learning how to inhabit that porosity without losing one’s footing in ordinary life.\n\nAs a chapter in the book’s larger arc, this section inaugurates the transtemporal turn, transforming earlier purgation into a disciplined capacity to navigate layered time in service of a deeper, ethically binding vision of reality.",
  "keywords": [
    "deep time",
    "transtemporality",
    "phenomenology",
    "memory retrieval",
    "psychedelic sessions",
    "temporal layers",
    "arrow of time",
    "ontology of time",
    "karma",
    "vow"
  ],
  "concept_links": [
    "deep_time",
    "death_rebirth"
  ],
  "notes": "The summary foregrounds experiential recurrence as the criterion of reality while acknowledging the unresolved tension between phenomenological bracketing and ontological commitment.",
  "model": "gpt-5",
  "words_target": 400,
  "src_dir": "reflowed_text"
}