{
  "section_file": "lsdmu_c09_s02.md",
  "title": "The Great Awakening",
  "summary": "Set like a sudden bell between visits to the Diamond Luminosity, this vision pivots from personal healing into a species-scale aperture. The narrator’s childhood grief fractures like painted glass—an inner edifice reaching its pitch and shattering—opening into a nonpersonal field where consciousness moves as the species itself. Inside this transpersonal vantage, the Divine-in-time is felt as the living interior of humanity’s evolution: arousal and anxiety gathering like storm bands within the collective psyche, each droplet a person, the whole a weather system. Decades condense to minutes. An ecological cataclysm—untimed, unpictured—functions as catalyst rather than forecast, stripping away assumptions about livelihood, location, ownership, and order until survival melts identities into a common crucible. Families dissolve and recombine; new kinships and institutions self-organize around values discovered under duress. Awareness spreads as a positive contagion, each emergent form calling forth deeper capacities in individuals, and those capacities, in turn, reshaping the social. The species-brain seems to myelinate: pathways thicken, synchrony quickens. A repeated transmission lands—faster than anyone can anticipate—annulling the past as measure of the future. The mechanism intimated is not merely historical pressure but psychic overpressure: suffering saturates the species-field, liquefying rigid patterns in the collective unconscious, precipitating a phase transition where fear and necessity entrain attention, synchronize hearts, and allow archetypal intelligence to refract through many at once. Crisis becomes the initiatory fire that fuses isolated selves into a single responsive organ of perception and care. From within this field, events are not simply happening to us; Creative Intelligence is drawing forth new specieswide competencies from within us, the way a seed draws on the whole earth to break open. The placement amid Diamond Luminosity underscores that the collective death-rebirth unfolds not apart from the luminous ground but through it—illumination becoming infrastructure—so that the shock of disintegration delivers the species to a more coherent, relational, and responsive consciousness. In its awe and exhaustion, the session offers not a timetable but a morphology of awakening: shattering, melting, reweaving, accelerating, and stabilizing as a new social-psychic ecology. This section situates the book’s arc within a planetary initiation, translating private revelation into a map of the future human emerging under ecological duress.",
  "keywords": [
    "collective psyche",
    "ecological crisis",
    "species-mind",
    "creative intelligence",
    "archetypal death-rebirth",
    "acceleration",
    "new social forms",
    "hyper-arousal",
    "transpersonal vision"
  ],
  "concept_links": [
    "diamond_luminosity",
    "death_rebirth"
  ],
  "notes": "Placed between Diamond Luminosity sessions (45, 50, 60, 66), Session 55 reframes the personal path as a species initiation; the truncated mechanism section is rendered here as a phase-transition model of the collective unconscious under crisis.",
  "model": "gpt-5",
  "words_target": 400,
  "src_dir": "reflowed_text"
}